link,preco,descricao,forma_pagamento,cidade,bairro,endereco,tipo_imovel,processo_link,leiloeiro,ocupado,imagem1,imagem2,imagem3
https://leilao.sodresantoro.com.br/leilao/23756/lote/2579543/,255.000,"Imóvel: Rio de Janeiro/RJ. Sala 1702 com direito a uma vaga na garagem localizada no 4° pavimento do Edifício Seller Center, situado na Rua da Conceição n° 188, melhor descrito e caracterizado na Matrícula sob nº 12.435 do Cartório do 18° Ofício de Justiça de Niterói NIterói/RJ. Obs. 1: O imóvel está sendo   comercializado no estado em que se encontra, tanto em termos físicos quanto em termos documentais, cabendo exclusivamente ao comprador se informar antecipadamente sobre tais estados e efetuar sua proposta, considerando possíveis regularizações posteriores a venda. Obs. 2: Os débitos de IPTU e Condomínio vincendas (parcelas a vencer), deverão ser apurados pelo comprador e a partir da data da compra será de sua responsabilidade efetuar os pagamentos. Obs. 3: Se o imóvel estiver ocupado, a desocupação do imóvel, ficará por conta do comprador. Obs. 4: Sob o imóvel recaí a ação de Execução Fiscal,  processo nº00006182620074025102 na 05ª Vara Federal de Niterói - NITEROI, com os seguintes gravames na matrícula : AV. 6 Penhora FN","Os pagamentos relativos aos negócios no Comprei serão feitos mediante DARF (Documento de Arrecadação de Receitas Federais) ou DJE emitido na plataforma. O comprador pagará ao intermediário deste anúncio, a título de comissão, o percentual fixado em decisão judicial ou administrativa que será pago via transferência bancária.",NITERÓI / RJ,CENTRO,"RUA DA CONCEIÇÃO, Nº 188 -  LOJA Nº 1702 DO EDIFÍCIO SELLER CENTER",Loja de shopping,https://comprei.pgfn.gov.br/anuncio/detalhe/27802,Otavio Lauro Sodre Santoro / 607,n/a,https://photos.sodresantoro.com.br/imoveis/23756/2579543/1735221961_I16484N1.JPG?ims=x597,n/a,n/a
https://leilao.sodresantoro.com.br/leilao/23756/lote/2579544/,289.000,"Imóvel: Rio de Janeiro/RJ. Loja n° 320 do Edifício Seller Center, situado na Rua da Conceição n° 188, melhor descrito e caracterizado na Matrícula sob nº 10.516 do Cartório do 18° Ofício de Justiça de Niterói NIterói/RJ. Obs. 1: O imóvel está sendo   comercializado no estado em que se encontra, tanto em termos físicos quanto em termos documentais, cabendo exclusivamente ao comprador se informar antecipadamente sobre tais estados e efetuar sua proposta, considerando possíveis regularizações posteriores a venda. Obs. 2: Os débitos de IPTU e Condomínio vincendas (parcelas a vencer), deverão ser apurados pelo comprador e a partir da data da compra será de sua responsabilidade efetuar os pagamentos. Obs. 3: Se o imóvel estiver ocupado, a desocupação do imóvel, ficará por conta do comprador. Obs. 4: Sob o imóvel recaí a ação de Execução Fiscal,  processo nº00006182620074025102 na 05ª Vara Federal de Niterói - NITEROI, com os seguintes gravames na matrícula : AV. 8 Penhora FN","Os pagamentos relativos aos negócios no Comprei serão feitos mediante DARF (Documento de Arrecadação de Receitas Federais) ou DJE emitido na plataforma. O comprador pagará ao intermediário deste anúncio, a título de comissão, o percentual fixado em decisão judicial ou administrativa que será pago via transferência bancária.",NITERÓI / RJ,CENTRO,"RUA DA CONCEIÇÃO, Nº 188 - LOJA Nº 320 DO EDIFÍCIO SELLER CENTER",Loja de shopping,https://comprei.pgfn.gov.br/anuncio/detalhe/27791,Otavio Lauro Sodre Santoro / 607,n/a,https://photos.sodresantoro.com.br/imoveis/23756/2579544/1735222124_I16485N1.JPG?ims=x597,n/a,n/a
https://leilao.sodresantoro.com.br/leilao/23756/lote/2586051/,4.000.000,"Imóvel: São Paulo/SP. Bela Vista. Conjunto n° 801, localizado no 8° andar, do Edifício Numa de Oliveira, situado na Avenida Paulista, n° 1.009 (entrada principal), , melhor descrito e caracterizado na Matrícula sob nº 9.8547   do 4° Cartório de Registo de Imóveis de São Paulo/SP. Obs.1: O imóvel está sendo comercializado no estado em que se encontra, tanto em termos físicos quanto em termos documentais, cabendo exclusivamente ao comprador se informar antecipadamente sobre tais estados e efetuar sua proposta, considerando possíveis regularizações posteriores a venda. Obs.2: Os débitos de IPTU e Condomínio vincendas (parcelas a vencer), deverão ser apurados pelo comprador e a partir da data da compra será de sua responsabilidade efetuar os pagamentos. . Obs.3: Sobre o imóvel recaí  ação fiscal, processo nº 00011581920114036133, em trâmite na Xª Vara 01ª Vara Federal de Mogi das Cruzes - MOGI DAS CRUZES).   e nos seguintes Gravames: Arresto R11 | Penhora R12, R13, R14, R16 e R17. OCUPADO Obs.4: Se o imóvel estiver ocupado, a desocupação do imóvel, ficará por conta do comprador.","Os pagamentos relativos aos negócios no Comprei serão feitos mediante DARF (Documento de Arrecadação de Receitas Federais) ou DJE emitido na plataforma. O comprador pagará ao intermediário deste anúncio, a título de comissão, o percentual fixado em decisão judicial ou administrativa que será pago via transferência bancária.",SÃO PAULO / SP,BELA VISTA,"AVENIDA PAULISTA, N° 1009 - CONJ. N° 801 - 8° ANDAR DO ED. NUMA DE OLIVEIRA",Sala comercial,https://comprei.pgfn.gov.br/anuncio/detalhe/28071,Otavio Lauro Sodre Santoro / 607,n/a,https://photos.sodresantoro.com.br/imoveis/23756/2586051/1736519768_I16504N1.JPG?ims=x597,n/a,n/a
https://leilao.sodresantoro.com.br/leilao/23756/lote/2616274/,75.000,"Imóvel: São Paulo/SP. Bela Vista. Lugar individual n° 65, localizado no 2° sub-solo, do Edifício Numa de Oliveira, situado na Avenida Paulista, n° 1.009 ( entrada principal), correspondendo-lhe a fração ideal de 1/149 ávos do total da garagem, a qual em seu todo, tem a área construída de 5.587,61m² e o n° de Contribuinte sob o n° 009.062.0043-1, melhor descrito e caracterizado na Matrícula sob nº 98.548   do 4° Cartório de Registro de Imóveis de São Paulo/SP. Obs.1: O imóvel está sendo comercializado no estado em que se encontra, tanto em termos físicos quanto em termos documentais, cabendo exclusivamente ao comprador se informar antecipadamente sobre tais estados e efetuar sua proposta, considerando possíveis regularizações posteriores a venda. Obs.2: Os débitos Condomínio vincendas (parcelas a vencer), deverão ser apurados pelo comprador e a partir da data da compra será de sua responsabilidade efetuar os pagamentos.Obs.3: Caso haja construção pendente de averbação no RI, ficará a cargo do arrematante regularizar. Obs.4: Sobre o imóvel recaí ação de execução fiscal, processo nº 00011581920114036133  em trâmite na01ª Vara Federal de Mogi das Cruzes - MOGI DAS CRUZES. Penhora R9, R10, R12, R13. Obs.5: Se o imóvel estiver ocupado, a desocupação do imóvel, ficará por conta do comprador.","Os pagamentos relativos aos negócios no Comprei serão feitos mediante DARF (Documento de Arrecadação de Receitas Federais) ou DJE emitido na plataforma. O comprador pagará ao intermediário deste anúncio, a título de comissão, o percentual fixado em decisão judicial ou administrativa que será pago via transferência bancária.",SÃO PAULO / SP,BELA VISTA,"AVENIDA PAULISTA - EDIFÍCIO NUMA DE OLIVEIRA, N° 1009",VAGA DE GARAGEM,https://comprei.pgfn.gov.br/anuncio/detalhe/36245,Otavio Lauro Sodre Santoro / 607,n/a,https://photos.sodresantoro.com.br/imoveis/23756/2616274/1744220267_I16543N1.JPG?ims=x597,n/a,n/a
https://leilao.sodresantoro.com.br/leilao/23756/lote/2616276/,75.000,"Imóvel:São Paulo/SP. Bela Vista. Lugar individual n° 66, localizado no 2° sub- solo, do Edifício Numa de Oliveira, situado na Avenida Paulista, n° 1.009 ( entrada principal), correspondendo-lhe a fração ideal de 1/149 ávos dototal da garagem, a qual em seu todo, tem a área construída de 5.587,61m² e o n° de Contribuinte sob o n° 009.062.0043-1, melhor descrito e caracterizado na Matrícula sob nº 98.549   do 4° Cartório de Registro de Imóveis de São Paulo/SP.Obs.1: O imóvel está sendo comercializado no estado em que se encontra, tanto em termos físicos quanto em termos documentais, cabendo exclusivamente ao comprador se informar antecipadamente sobre tais estados e efetuar sua proposta, considerando possíveis regularizações posteriores a venda. Obs.2: Os débitos Condomínio vincendas (parcelas a vencer), deverão ser apurados pelo comprador e a partir da data da compra será de sua responsabilidade efetuar os pagamentos.Obs.3: Caso haja construção pendente de averbação no RI, ficará a cargo do arrematante regularizar. Obs.4: Sobre o imóvel recaí ação de execução fiscal, processo nº 00011581920114036133  em trâmite na01ª Vara Federal de Mogi das Cruzes - MOGI DAS CRUZES. Penhora R9, R10, R12, R13. Obs.5: Se o imóvel estiver ocupado, a desocupação do imóvel, ficará por conta do comprador.","Os pagamentos relativos aos negócios no Comprei serão feitos mediante DARF (Documento de Arrecadação de Receitas Federais) ou DJE emitido na plataforma. O comprador pagará ao intermediário deste anúncio, a título de comissão, o percentual fixado em decisão judicial ou administrativa que será pago via transferência bancária.",SÃO PAULO / SP,BELA VISTA,"AVENIDA PAULISTA - EDIFÍCIO NUMA DE OLIVEIRA, N° 1.009",VAGA DE GARAGEM,https://comprei.pgfn.gov.br/anuncio/detalhe/36246,Otavio Lauro Sodre Santoro / 607,n/a,https://photos.sodresantoro.com.br/imoveis/23756/2616276/1744222788_I16544N1.JPG?ims=x597,n/a,n/a
https://leilao.sodresantoro.com.br/leilao/23756/lote/2616277/,75.000,"Imóvel:São Paulo/SP. Bela Vista. Lugar individual n° 67, localizado no 2° sub-solo, do Edifício Numa de Oliveira, situado na Avenida Paulista, n° 1.009 ( entrada principal), correspondendo-lhe a fração ideal de 1/149 ávos dototal da garagem, a qual em seu todo, tem a área construída de 5.587,61m² e o n° de Contribuinte sob o n° 009.062.0043-1, melhor descrito e caracterizado na Matrícula sob nº 98.550   do 4° Cartório de Registro de Imóveis de São Paulo/SP. Obs.1: O imóvel está sendo comercializado no estado em que se encontra, tanto em termos físicos quanto em termos documentais, cabendo exclusivamente ao comprador se informar antecipadamente sobre tais estados e efetuar sua proposta, considerando possíveis regularizações posteriores a venda. Obs.2: Os débitos Condomínio vincendas (parcelas a vencer), deverão ser apurados pelo comprador e a partir da data da compra será de sua responsabilidade efetuar os pagamentos.Obs.3: Caso haja construção pendente de averbação no RI, ficará a cargo do arrematante regularizar. Obs.4: Sobre o imóvel recaí ação de execução fiscal, processo nº 00011581920114036133  em trâmite na01ª Vara Federal de Mogi das Cruzes - MOGI DAS CRUZES. Penhora R9, R10, R12, R13. Obs.5: Se o imóvel estiver ocupado, a desocupação do imóvel, ficará por conta do comprador.","Os pagamentos relativos aos negócios no Comprei serão feitos mediante DARF (Documento de Arrecadação de Receitas Federais) ou DJE emitido na plataforma. O comprador pagará ao intermediário deste anúncio, a título de comissão, o percentual fixado em decisão judicial ou administrativa que será pago via transferência bancária.",SÃO PAULO / SP,BELA VISTA,"AVENIDA PAULISTA - EDIFÍCIO NUMA DE OLIVEIRA, N° 1.009",VAGA DE GARAGEM,https://comprei.pgfn.gov.br/anuncio/detalhe/36269,Otavio Lauro Sodre Santoro / 607,n/a,https://photos.sodresantoro.com.br/imoveis/23756/2616277/1744223358_I16545N1.JPG?ims=x597,n/a,n/a
https://leilao.sodresantoro.com.br/leilao/23756/lote/2616278/,75.000,"Imóvel: São Paulo/SP. Bela Vista. Lugar individual n° 68, localizado no 2° sub- solo, do Edifício Numa de Oliveira, situado na Avenida Paulista, n° 1.009 ( entrada principal), correspondendo-lhe a fração ideal de 1/149 ávos dototal da garagem, a qual em seu todo, tem a área construída de 5.587,61m² e o n° de Contribuinte sob o n° 009.062.0043-1, melhor descrito e caracterizado na Matrícula sob nº 98.551   do 4° Cartório de Registro de Imóveis de São Paulo/SP. Obs.1: O imóvel está sendo comercializado no estado em que se encontra, tanto em termos físicos quanto em termos documentais, cabendo exclusivamente ao comprador se informar antecipadamente sobre tais estados e efetuar sua proposta, considerando possíveis regularizações posteriores a venda. Obs.2: Os débitos Condomínio vincendas (parcelas a vencer), deverão ser apurados pelo comprador e a partir da data da compra será de sua responsabilidade efetuar os pagamentos.Obs.3: Caso haja construção pendente de averbação no RI, ficará a cargo do arrematante regularizar. Obs.4: Sobre o imóvel recaí ação de execução fiscal, processo nº 00011581920114036133  em trâmite na01ª Vara Federal de Mogi das Cruzes - MOGI DAS CRUZES. Penhora R9, R10, R12, R13. Obs.5: Se o imóvel estiver ocupado, a desocupação do imóvel, ficará por conta do comprador.","Os pagamentos relativos aos negócios no Comprei serão feitos mediante DARF (Documento de Arrecadação de Receitas Federais) ou DJE emitido na plataforma. O comprador pagará ao intermediário deste anúncio, a título de comissão, o percentual fixado em decisão judicial ou administrativa que será pago via transferência bancária.",SÃO PAULO / SP,BELA VISTA,"AVENIDA PAULISTA - EDIFÍCIO NUMA DE OLIVEIRA, N° 1.009",VAGA DE GARAGEM,https://comprei.pgfn.gov.br/anuncio/detalhe/36248,Otavio Lauro Sodre Santoro / 607,n/a,https://photos.sodresantoro.com.br/imoveis/23756/2616278/1744223917_I16546N1.JPG?ims=x597,n/a,n/a
https://leilao.sodresantoro.com.br/leilao/23756/lote/2616279/,75.000,"Imóvel: São Paulo/SP. Bela Vista. Lugar individual n° 69, localizado no 2° sub-solo, do Edifício Numa de Oliveira, situado na Avenida Paulista, n° 1.009 ( entrada principal), correspondendo-lhe a fração ideal de 1/149 ávos dototal da garagem, a qual em seu todo, tem a área construída de 5.587,61m² e o n° de Contribuinte sob o n° 009.062.0043-1, melhor descrito e caracterizado na Matrícula sob nº 98.552   do 4° Cartório de Registro de Imóveis de São Paulo/SP.Obs.1: O imóvel está sendo comercializado no estado em que se encontra, tanto em termos físicos quanto em termos documentais, cabendo exclusivamente ao comprador se informar antecipadamente sobre tais estados e efetuar sua proposta, considerando possíveis regularizações posteriores a venda. Obs.2: Os débitos Condomínio vincendas (parcelas a vencer), deverão ser apurados pelo comprador e a partir da data da compra será de sua responsabilidade efetuar os pagamentos.Obs.3: Caso haja construção pendente de averbação no RI, ficará a cargo do arrematante regularizar. Obs.4: Sobre o imóvel recaí ação de execução fiscal, processo nº 00011581920114036133  em trâmite na01ª Vara Federal de Mogi das Cruzes - MOGI DAS CRUZES. Penhora R9, R10, R12, R13. Obs.5: Se o imóvel estiver ocupado, a desocupação do imóvel, ficará por conta do comprador.","Os pagamentos relativos aos negócios no Comprei serão feitos mediante DARF (Documento de Arrecadação de Receitas Federais) ou DJE emitido na plataforma. O comprador pagará ao intermediário deste anúncio, a título de comissão, o percentual fixado em decisão judicial ou administrativa que será pago via transferência bancária.",SÃO PAULO / SP,BELA VISTA,"AVENIDA PAULISTA - EDIFÍCIO NUMA DE OLIVEIRA, N° 1.009",VAGA DE GARAGEM,https://comprei.pgfn.gov.br/anuncio/detalhe/36276,Otavio Lauro Sodre Santoro / 607,n/a,https://photos.sodresantoro.com.br/imoveis/23756/2616279/1744224603_I16547N1.JPG?ims=x597,n/a,n/a
https://leilao.sodresantoro.com.br/leilao/23756/lote/2621108/,472.500,"Imóvel:Recife/PE. Boa Viagem. Apartamento de n° 701, localizado no 7° pavimento elevado do Edifício LE CHATEAU BLOIS, situado na Rua General Americano Freire n° 798, em Boa Viagem, com área privativa de 128,34m², com direito a uma vaga de estacionamento e Inscrição Municipal sob n° 6.1835.170.02.0252.0013.7 melhor descrito e caracterizado na Matrícula sob nº 59.992   do 1° Registro de Imóveis de Recife/PE.Obs.1: O imóvel está sendo comercializado no estado em que se encontra, tanto em termos físicos quanto em termos documentais, cabendo exclusivamente ao comprador se informar antecipadamente sobre tais estados e efetuar sua proposta, considerando possíveis regularizações posteriores a venda. Obs.2: Os débitos de IPTU e Condomínio vincendas (parcelas a vencer), deverão ser apurados pelo comprador e a partir da data da compra será de sua responsabilidade efetuar os pagamentos.Obs.3: Caso haja construção pendente de averbação no RI, será regularizada pelo arrematante. Obs.4: Sobre o imóvel recaí ação de execução fiscal, processo nº 00099598620164058300, em trâmite na 33ª Vara Federal - RECIFE. HIPOTECA (R11), PENHORA (R12)DÉBITOS DE CONDOMÍNIOS FICAM A CARGO DO ADQUIRENTE. Obs.5: Se o imóvel estiver ocupado, a desocupação do imóvel, ficará por conta do comprador.","Os pagamentos relativos aos negócios no Comprei serão feitos mediante DARF (Documento de Arrecadação de Receitas Federais) ou DJE emitido na plataforma. O comprador pagará ao intermediário deste anúncio, a título de comissão, o percentual fixado em decisão judicial ou administrativa que será pago via transferência bancária.",RECIFE / PE,BOA VIAGEM,"RUA GENERAL AMERICANO, N° 798 - APTO. 701 - ED. LE CHATEAU BLOIS",Apartamento,https://comprei.pgfn.gov.br/anuncio/detalhe/37099,Otavio Lauro Sodre Santoro / 607,n/a,https://photos.sodresantoro.com.br/imoveis/23756/2621108/1745517026_I16574N1.JPG?ims=x597,https://photos.sodresantoro.com.br/imoveis/23756/2621108/1745517026_I16574N3.JPG?ims=x597,https://photos.sodresantoro.com.br/imoveis/23756/2621108/1745517026_I16574N4.JPG?ims=x597
