link,preco,descricao,forma_pagamento,cidade,bairro,endereco,tipo_imovel,processo_link,leiloeiro,ocupado,imagem1,imagem2,imagem3
https://leilao.sodresantoro.com.br/leilao/27033/lote/2616744/,6.000.000,"Ilhabela/SP. Siriúba. Imóvel residencial, situado a Av. Leonardo Reale, no 3.093, com 638,73 m2 de terreno, 202,82 m2 de área construída e aproximadamente 1.600 m2 de área de marinha para uso particular, melhor descrito e caracterizado na Matrícula no 35.869 do Registro de Imóveis de São Sebastião/SP. Localizado na exclusiva Praia do Arrozal, a apenas 4 km da Vila e 2 km da Praia da Armação # principal centro de vela de Ilhabela. Posicionado cerca de 20 metros acima do nível do mar, oferece vista permanente e privilegiada. Acesso reservado à praia, compartilhado por apenas cinco residências, com píer exclusivo aos condôminos. Região tranquila, com infraestrutura completa. Inscrição Municipal sob o n° de 1002.3093.0010. Imóvel cadastrado no Sistema de Patrimonio da União, sob o no 6509 0100128-16. Obs.1: O imóvel está sendo leiloado no estado em que se encontra, tanto em termos físicos quanto em termos documentais, cabendo exclusivamente ao comprador se informar antecipadamente sobre tais estados e efetuar seus lances considerando possíveis regularizações posteriores ao leilão. Obs.2: A regularização do registro da doação do imóvel, oriunda de sentença em processo de inventário ainda não concluído, será de responsabilidade exclusiva do COMPRADOR, que adotará a medida judicial e/ou extrajudicial que melhor convier. Após essa regularização, caberá ao ARREMATANTE formalizar a transferência da propriedade em seu nome, arcando com os respectivos custos, tributos e emolumentos. Obs.3: Os débitos de IPTU e SPU(laudemio), deverão ser apurados e pagos pelo arrematante, sem direito a reembolso. Consta débito de IPTU vinculado ao imóvel, cujo montante, atualizado até o exercício de 2025, é de aproximadamente R$ 380.000,00 (trezentos e oitenta mil reais), valor este que será de responsabilidade do comprador. Há também débito perante a Secretaria do Patrimônio da União (SPU), a título de laudêmio, no valor aproximado de R$150.000,00 (cento e cinquenta mil reais), igualmente de responsabilidade do arrematante. Obs.4: Caso haja construção pendente de averbação no RI, ficará de responsabilidade do arrematante a devida regularização. Obs.5: Consta ação de inventário, processo no 0024751-62.2011.8.26.0100 dos bens deixados pelo Sr. Sylvio Seixas Ribeiro Bastos, em trâmite na 8a Vara da Família e Sucessões da Comarca de São Paulo/SP e duas ações de Execução Fiscal # Dívida Ativa da 1° Vara do Foro de Ilhabela/SP sob o n° 1501898-09.2023.8.26.0247 e 1500042-44.2022.8.26.0247. O vendedor responde pelo resultado da ação, de acordo com os critérios e limites estabelecidos nas #Condições de Venda dos Imóveis# constantes do edital. Obs. 6: Imóvel é objeto de inventário, sendo que a titularidade do bem é compartilhada entre a AACD e a entidade Aldeias Infantis, cabendo 50% a cada uma das instituições. A venda se efetivada, ocorrerá mediante deposito do valor em juízo. DESOCUPADO. É permitida a visitação, que deverá serpreviamente agendada com Sr. Emerson pelo número Tel.: 11 - 2464-6460 / Celular 11 - 97777-0753 ou através do e-mailaf@sodresantoro.com.br.",O pagamento desse lote será feito por meio de transferência bancária e a comissão do leiloeiro deverá ser depositada em conta corrente a ser informada.,ILHA BELA / SP,SIRIÚBA,"AVENIDA LEONARDO REALE, 3.093",Casa,n/a,Flavio Cunha Sodre Santoro / 581,Desocupado,https://photos.sodresantoro.com.br/imoveis/27033/2616744/1744294210_I16548N13.JPG?ims=x597,https://photos.sodresantoro.com.br/imoveis/27033/2616744/1744305279_I16548N22.JPG?ims=x597,https://photos.sodresantoro.com.br/imoveis/27033/2616744/1751391333_I16548N24.JPG?ims=x597
https://leilao.sodresantoro.com.br/leilao/27385/lote/2651130/,780.426,"Localização do imóvel: Um terreno urbano área de terras urbanas, localizado na Rua Juscelino Kubitschek em Rondon do Pará-PA, medindo 1.465,67m², melhor descrito e caracterizado na matrícula sob o n° 9.495 do Cartório do Único Ofício de Rondon do Pará/PA. Localização do imóvel: Uma área de terras urbanas medindo 796,23m², situado na quadra formada pelas ruas: Rua Castro Alves, Rua Raimundo Cruz, Rua Presidente Costa e Silva e Rua Juscelino Kubitschek, melhor descrito e caracterizado na matrícula sob o n° 967 do Cartório do Único Ofício de Rondon do Pará/PA. Desocupado. Obs.1: O imóvel está sendo leiloado no estado em que se encontra, tanto em termos físicos quanto em termos documentais, cabendo exclusivamente ao comprador se informar antecipadamente sobre tais estados e efetuar seus lances considerando possíveis regularizações posteriores ao leilão; Obs.2: Eventuais averbações, regularizações e registros referente a construção e/ou demolição, deverão ser apurados e pagos pelo arrematante junto aos órgãos competentes.",O pagamento desse lote será feito por meio de transferência bancária e a comissão do leiloeiro deverá ser depositada em conta corrente a ser informada.,PARÁ / PA,RONDON DO PARÁ,RUA JUSCELINO KUBITSCHEK,2 Terrenos,n/a,Flavio Cunha Sodre Santoro / 581,Desocupado,https://photos.sodresantoro.com.br/imoveis/27385/2651130/1752777726_I16633N2.JPG?ims=x597,https://photos.sodresantoro.com.br/imoveis/27385/2651130/1753189984_I16633N3.JPG?ims=x597,https://photos.sodresantoro.com.br/imoveis/27385/2651130/1752777675_I16633N1.JPG?ims=x597
https://leilao.sodresantoro.com.br/leilao/27227/lote/2638675/,825.000,"Guarujá/SP. Praia das Pitangueiras. Apartamento n° 171, localizado no 16° pavimento de cobertura do Bloco A do Condomínio Forest Hill, situado na Rua Sorocaba n° 80, contendo a área privativa de 215,50m², vinculadas a esse apartamento as vagas de garagem sob os nº: 29, 30, 31 e 32, com área total de 347,19m².Inscrição Imobiliária sob o n° 0-0071-013-031, melhor descrito e caracterizado na Matrícula sob nº 72.695 do Cartório de Registro de Imóveis de Guarujá/SP. Obs.1: O imóvel está sendo leiloado no estado em que se encontra, tanto em termos físicos quanto em termos documentais, cabendo exclusivamente ao comprador se informar antecipadamente sobre tais estados e efetuar seus lances considerando possíveis regularizações posteriores ao leilão. Obs.2: Os débitos de Condomínio vincendas (parcelas a vencer), deverão ser apurados e pagos pelo arrematante, sem direito a reembolso, a partir da data do leilão. Obs.3: Caso haja construção pendente de averbação no RI ficará a cargo do arrematante a regularização. DESOCUPADO. É permitida a visitação, que deverá ser previamente agendada com Sr. Emerson pelo número Tel.: 11 - 2464-6460 / Celular 11 - 97777-0753 ou através do e-mail af@sodresantoro.com.br.",O pagamento desse lote será feito por meio de transferência bancária e a comissão do leiloeiro deverá ser depositada em conta corrente a ser informada.,GUARUJÁ / SP,PRAIA DAS PITANGUEIRAS,"RUA SOROCABA, N° 80 - APTO. 171 - COND. EDIFÍCIO FOREST HILL",Apartamento,n/a,Flavio Cunha Sodre Santoro / 581,Desocupado,https://photos.sodresantoro.com.br/imoveis/27227/2638675/1749578237_I16610N1.JPG?ims=x597,https://photos.sodresantoro.com.br/imoveis/27227/2638675/1749578237_I16610N14.JPG?ims=x597,https://photos.sodresantoro.com.br/imoveis/27227/2638675/1749578237_I16610N15.JPG?ims=x597
https://leilao.sodresantoro.com.br/leilao/27284/lote/2642494/,300.000.000,"Bem IMÓVEL e todo COMPLEXO DE SISTEMA INTEGRADO DE UNIDADES INDUSTRIAIS destinado ao processo produtivo de Hidroxipropilmetilcelulose (HPMC), compreendendo todo o maquinário vinculado à produção, conforme relação detalhada em documento anexo ao edital e que integra o presente para todos os fins de Direito.Localização: Via das Torres, s/n°, Distrito Industrial, Candeias/BA, CEP 43813-100.Uma gleba de terras com área total de 1.007.115,50m², sobre a qual foram erigidos diversos prédios que somam aproximadamente 14.486,40 m² de área edificada. O complexo é composto por prédios destinados a diferentes finalidades, incluindo: administração, balança de veículos, portaria, bombas de combate a incêndio, sistema de efluentes, compressor de ar, laboratório, refeitório, gases, administração principal, engenharia, armazenamento de produto final, manutenção, além de diversos galpões e outras edificações de menor porte.O BEM está melhor descrito e caracterizado na Matrícula nº 1.512 do 1º CRI de Candeias/BA.Cadastro ou inscrição imobiliária: 6300107292-9993.Obs.: Bens móveis que estiverem no imóvel mas que NÃO integram a relação anexa ao presente edital, se assim pretender o comprador, poderão ser objeto de negociação direta com o Comitente-Vendedor",O pagamento desse lote será feito por meio de transferência bancária e a comissão do leiloeiro deverá ser depositada em conta corrente a ser informada.,CANDEIAS / BA,DISTRITO INDUSTRIAL,VIA DAS TORRES S/N,Complexo Industrial,n/a,Luiz Fernando de Abreu Sodre Santoro / 192,Desocupado,https://photos.sodresantoro.com.br/imoveis/27284/2642494/1750434162_I16617N6.JPG?ims=x597,https://photos.sodresantoro.com.br/imoveis/27284/2642494/1750434162_I16617N1.JPG?ims=x597,https://photos.sodresantoro.com.br/imoveis/27284/2642494/1750434162_I16617N4.JPG?ims=x597
https://leilao.sodresantoro.com.br/leilao/27340/lote/2645183/,278.633,"Apartamento n° 82, localizado no 8º pavimento do (Edifício Florinda), situado na Rua Abolição, n° 66 e 68, no 17º Subdistrito da Bela Vista, São Paulo/SP, possui a área construída de 41,24 m², correspondendo-lhe a quota parte ideal de 2,250% no terreno. Matrícula nº 163.015, do 4º CRI da Capital/SP Contribuinte municipal nº 006.040.0070-7 Avaliação: R$ 266.333,33 (outubro/2024)Ônus/restrições: Consta da matrícula do imóvel, em Av.08, a penhora dos presentes autos, cujo montante executado é de R$ 65.036,61 (junho/2024).",O pagamento desse lote será feito por meio de uma guia de depósito judicial e a comissão do leiloeiro deverá ser depositada em conta corrente a ser informada. Toda a instrução de pagamento será enviada ao e-mail cadastrado do vencedor.,SÃO PAULO / SP,BELA VISTA,"RUA ABOLIÇÃO, N° 66 E 68",Apartamento,https://encurtador.com.br/OAQ4i,Carolina Lauro Sodre Santoro / 758,n/a,https://photos.sodresantoro.com.br/imoveis/27340/2645183/1751307697_I16625N2.JPG?ims=x597,https://photos.sodresantoro.com.br/imoveis/27340/2645183/1751307697_I16625N1.JPG?ims=x597,n/a
https://leilao.sodresantoro.com.br/leilao/27342/lote/2645213/,1.437.477,"Apartamento nº 72, localizado no 7º andar do (Edifício Marrocos),  situado na Rua Padre Capra, n° 120, Santo André/SP, contendo living com sacada, hall, biblioteca, lavabo, banheiro, três dormitórios, sendo um banheiro privativo e roupeiro, cozinha, sala de refeições, área de serviço, W.C., dispensa e lavanderia, possui área privativa de 260,37 m² e 60,55 m² de área comum, estando nesta incluída a área de garagem, com a área total de 320,92 m², correspondendo-lhe a fração ideal de 59,57 m², e confina: considerando suas porta de entrada como frente, confrontam por estas com os halls de serviço e social, com as caixas de escadaria e Rua Padre Capra; pelos lados com a área livre que circunda o prédio; e pelos fundos com a Rua Padre Capra. Matrícula nº 6.903, do 1º CRI de Santo André/SP. Avaliação: R$ 1.030.000,00 (dezembro/2019)Ônus/restrições: Constam da matrícula do imóvel em (Av.06) a penhora em favor de Celso Cerveline e Outros, nos autos n° 1556/06, 1ª Vara Cível de Santo André/SP; em (Av.07), a penhora dos presentes autos.",O pagamento desse lote será feito por meio de uma guia de depósito judicial e a comissão do leiloeiro deverá ser depositada em conta corrente a ser informada. Toda a instrução de pagamento será enviada ao e-mail cadastrado do vencedor.,SANTO ANDRÉ / SP,VILA ASSUNÇÃO,"RUA PADRE CAPRA, N° 120",Apartamento,https://encurtador.com.br/831Wc,Luiz Fernando de Abreu Sodre Santoro / 192,n/a,https://photos.sodresantoro.com.br/imoveis/27342/2645213/1735212080_I16495N13.JPG?ims=x597,https://photos.sodresantoro.com.br/imoveis/27342/2645213/1735212080_I16495N14.JPG?ims=x597,https://photos.sodresantoro.com.br/imoveis/27342/2645213/1735212080_I16495N1.JPG?ims=x597
https://leilao.sodresantoro.com.br/leilao/27330/lote/2643662/,19.500.000,"Sorocaba/SP. Bairro da Aparecida. Rua Quirino de Mello, 4.000, Terreno urbano, com área total de 165.729,70m² e área construída 245,48m² (Sitios do Moinho e Nossa Senhora da Aparecida II). Inscrição municipal 86.14.16.0001.00.000, melhor descrito e caracterizado na Matricula 73.226 do 01º RI local. Obs.1: O imóvel está sendo leiloado no estado em que se encontra, tanto em termos físicos quanto em termos documentais, cabendo exclusivamente ao comprador se informar antecipadamente sobre tais estados e efetuar seus lances considerando possíveis regularizações posteriores ao leilão. Obs.2: Os lançamentos de IPTU, deverão ser apurados e pagos pelo arrematante, sem direito a reembolso, a partir da data do leilão. Obs.3: Caso haja construção pendente de averbação no RI ficará a cargo do arrematante a regularização. Obs. 4: Trata-se de um terreno com 165.729m², com 4 platôs prontos para receber construção, 2 galpões 60% acabados com aproximadamente 600m² cada (sem alvarás ou licenças obrigatórias ao funcionamento); 1 galpão com aproximadamente 3.000m² com 40% da construção concluídos; ruas internas em terra com guias recuperáveis e alambrado em toda divisa do terreno. De acordo com o IPTU está categorizado como local de Corredor de Comércio e Insdutria Rural. DESOCUPADO. É permitida a visitação, que deverá ser previamente agendada com Sr. Emerson - pelo número Tel.: 11 - 2464-6460/ Celular 11-97777-0753 ou atraves do e-mail af@sodresantoro.com.br",O pagamento desse lote será feito por meio de transferência bancária e a comissão do leiloeiro deverá ser depositada em conta corrente a ser informada.,SOROCABA / SP,BAIRRO DA APARECIDA,"RUA QUIRINO DE MELLO, 4.000",Terreno urbano com benfeitorias,n/a,Flavio Cunha Sodre Santoro / 581,Desocupado,https://photos.sodresantoro.com.br/imoveis/27330/2643662/1750876443_I16624N2.JPG?ims=x597,https://photos.sodresantoro.com.br/imoveis/27330/2643662/1750876443_I16624N1.JPG?ims=x597,n/a
https://leilao.sodresantoro.com.br/leilao/27404/lote/2653012/,377.627,"Apartamento n° 27, localizado no 2º andar do (Edifício Três Reginas), situado à Rua Itaipu, n° 255, Mirandópolis, 21º Subdistrito da Saúde, São Paulo/SP, com as áreas: útil de 72,440 m²; comum de 30,424 m²; e total de 102,864 m², correspondendo-lhe a fração ideal de terreno de 3,542%, cabendo-lhe o direito ao uso de uma vaga na garagem localizada no subsolo do edifício, em local indeterminado e sujeito a manobrista. Matrícula nº 215.428, do 14° CRI da Capital/SP. Contribuinte municipal nº 045.142.0114-6. Avaliação: R$ 603.160,00 (outubro/2024).Conforme decisão de fls. 648/649, as partes poderão participar do certame em igualdade de condições com os demais licitantes, ficando garantido seu direito de preferência, nos termos do art. 1.322 do Código Civil, que será analisada ao final do pregão.",O pagamento desse lote será feito por meio de uma guia de depósito judicial e a comissão do leiloeiro deverá ser depositada em conta corrente a ser informada. Toda a instrução de pagamento será enviada ao e-mail cadastrado do vencedor.,SÃO PAULO / SP,MIRANDÓPOLIS,"RUA ITAIPU, N° 255",Apartamento,https://encurtador.com.br/65s5u,Carolina Lauro Sodre Santoro / 758,n/a,https://photos.sodresantoro.com.br/imoveis/27404/2653012/1748879117_I16611N5.JPG?ims=x597,https://photos.sodresantoro.com.br/imoveis/27404/2653012/1748879117_I16611N6.JPG?ims=x597,https://photos.sodresantoro.com.br/imoveis/27404/2653012/1748879117_I16611N7.JPG?ims=x597
https://leilao.sodresantoro.com.br/leilao/27367/lote/2648906/,4.800.000,"Barueri/SP.  Vila São Silvestre .Uma área de terras urbanas, situada na cidade de Barueri, na Avenida Calil Mohamed Rahal n° 636, com área total de 3.861,00m² , melhor descrito e caracterizado na Matrícula sob nº 81902 do Cartório de Registro de Imóveis de  Barueri/SP. Obs.1: O imóvel está sendo leiloado no estado em que se encontra, tanto em termos físicos quanto em termos documentais, cabendo exclusivamente ao comprador se informar antecipadamente sobre tais estados e efetuar seus lances considerando possíveis regularizações posteriores ao leilão. Obs.2: Os débitos de IPTU vincendas (parcelas a vencer), deverão ser apurados e pagos pelo arrematante, sem direito a reembolso, a partir da data do leilão. Obs.3: Caso haja construção pendente de averbação no RI ficará a cargo do arrematante a regularização. DESOCUPADO. É permitida a visitação, que deverá ser previamente agendada com Sr. Emerson pelo número Tel.: 11 - 2464-6460 / Celular 11 - 97777-0753 ou através do e-mail af@sodresantoro.com.br.",O pagamento desse lote será feito por meio de transferência bancária e a comissão do leiloeiro deverá ser depositada em conta corrente a ser informada.,BARUERI / SP,VILA SÃO SILVESTRE,"AVENIDA CALIL MOHAMAD RAHAL, N° 636",Terreno,n/a,Flavio Cunha Sodre Santoro / 581,Desocupado,https://photos.sodresantoro.com.br/imoveis/27367/2648906/1752170518_I16627N8.JPG?ims=x597,https://photos.sodresantoro.com.br/imoveis/27367/2648906/1752170518_I16627N7.JPG?ims=x597,https://photos.sodresantoro.com.br/imoveis/27367/2648906/1752170518_I16627N2.JPG?ims=x597
https://leilao.sodresantoro.com.br/leilao/27298/lote/2643022/,1.800.000,"Cotia/SP. Granja Viana. Um terreno urbano designado lote 05, do loteamento denominado Granja do Lago, situado na Rua Lago n° 555, com área total de 2.065,93m² e conforme consta do Habite-se n° 089/85, expedido pela Prefeitura Municipal de Cotia, procede-se a presente para constar que no imóvel projeto da presente matrícula, foi concedido alvará de vistoria e habite-se na construção com a área total de 400,69m². Segue descrição da disposição física do imóvel, que ressaltamos estar indo a leilão conforme previsto na cláusula ad corpus desse Edital, ou seja, na condição que o bem se encontra. Ficando o interessado responsável em realizar a visita prévia ao imóvel. Segue: Ex.: Hall social com lavabo;  Living para 3 ambientes, com lareira e piso em lajotas. Nicho para bar e linda varanda. Escritório repleto de móveis planejados, com vista para área de lazer. Três amplas suítes, com armários. Piso em carpete de madeira. A suíte Máster com grande closet e hidro. Quatro banheiros. Cozinha clara e espaçosa, com copa e armários planejados com 3 despensas. O Jardim possui um design com paisagismo e lago de carpas. Quiosque gourmet com churrasqueira e piscina em alvenaria com aquecimento. Lavanderia espaçosa e dependências de serviço (quarto e banheiro). Garagem com 4 vagas cobertas, mais 4 vagas externas e depósito. Quintal com horta e canil. Aquecimento central da água, melhor descrito e caracterizado na Matrícula sob nº34.214  do Cartório de Registro de Imóveis de Cotia/SP e Inscrição Imobiliária 23234.42.90.1018.00.000.  Obs.1: O imóvel está sendo leiloado no estado em que se encontra, tanto em termos físicos quanto em termos documentais, cabendo exclusivamente ao comprador se informar antecipadamente sobre tais estados e efetuar seus lances considerando possíveis regularizações posteriores ao leilão. Obs.2: Os débitos de IPTU vincendas (parcelas a vencer), deverão ser apurados e pagos pelo arrematante, sem direito a reembolso, a partir da data do leilão. Obs.3: Caso haja construção pendente de averbação no RI ficará a cargo do arrematante a regularização. DESOCUPADO. É permitida a visitação, que deverá ser previamente agendada com Sr. Emerson pelo número Tel.: 11 - 2464-6460 / Celular 11 - 97777-0753 ou através do e-mail af@sodresantoro.com.br",O pagamento desse lote será feito por meio de transferência bancária e a comissão do leiloeiro deverá ser depositada em conta corrente a ser informada.,COTIA / SP,GRANJA VIANA,RUA DO LAGO N° 555 - LOTEAMENTO GRANJA DO LAGO,Casa,n/a,Flavio Cunha Sodre Santoro / 581,Desocupado,https://photos.sodresantoro.com.br/imoveis/27298/2643022/1744641152_I16563N4.JPG?ims=x597,https://photos.sodresantoro.com.br/imoveis/27298/2643022/1744641152_I16563N1.JPG?ims=x597,https://photos.sodresantoro.com.br/imoveis/27298/2643022/1744641152_I16563N2.JPG?ims=x597
https://leilao.sodresantoro.com.br/leilao/27357/lote/2647852/,2.195.903,"Apartamento duplex n° 131, localizado no 13º andar e cobertura do (Edifício Vista Verde), situado na Rua dos Democratas, n° 691, no 42º Subdistrito do Jabaquara, São Paulo/SP, contendo a área útil de 323,1250 m² e área comum de 109,8060 m², perfazendo a área total construída de 432,9310 m², com uma fração ideal no terreno condominial de 5,7459%. A este apartamento corresponde duas vagas na garagem coletiva, em locais indeterminados, para estacionamento de dois veículos de passeio, contendo cada uma a área útil de 10,80 m² e área de circulação comum de 12,00 m², perfazendo a área total construída de 22,80 m², com uma fração ideal no terreno condominial de 0,17965%.Matrícula nº 99.097, do 6º CRI de São Paulo/SPContribuinte municipal nº 047.176.0431-8Avaliação: R$ 2.044.000,00 (fevereiro/2024)Ônus/restrições: (I) Constam da matrícula do imóvel, em (Av.04), a penhora em favor de Fundo de Investimentos em Direitos Creditórios Não Padronizados NPL I, nos autos n° 0104396-23.2008.8.26.0010, da 2ª Vara Cível do Foro Regional do Ipiranga/SP; em (Av.05), a indisponibilidade decretada nos autos n° 0007769-04.2009.8.26.0565, em tramite perante o Serviço Anexo das Fazendas de São Caetano do Sul/SP; em (Av.06), a indisponibilidade decretada nos autos n°  0184200-44.2007.5.02.0026, em tramite perante a 26ª Vara do Trabalho de São Paulo/SP; em (Av.07), a indisponibilidade decretada nos autos n° 0120700-05.2009.5.02.0003, em tramite perante a 3ª Vara do Trabalho de São Paulo/SP; em (Av.08), a penhora dos presentes autos, cujo débito executado alcança o montante de R$ 111.785,05 (fls. 562, março/2025); em (Av.09), a indisponibilidade decretada nos autos n° 1000623-75.2021.5.02.0084, em tramite perante a  84ª Vara do Trabalho de São Paulo/SP; em (Av.10), a indisponibilidade decretada nos autos n° 1001952-67.2016.5.02.0062, em tramite perante a 62ª Vara do Trabalho de São Paulo/SP; em (Av.11), a penhora em favor deste exequente, determinada nos autos n° 1028371-79.2022.8.26.0003, da 3ª Vara Cível deste Fórum; em (Av.12), a indisponibilidade decretada nos autos n° 0049900-80.2009.5.02.0316, em tramite perante a 6ª Vara do Trabalho de Guarulhos/SP; (II) Em pesquisa realizada no site da Prefeitura Municipal de São Paulo, foram localizados débitos de IPTU sobre o imóvel no valor de R$ 322.521,33 (junho/2025), correspondendo a valores inscritos em divida ativa e do ano vigente. Laudo de avaliação: Consta da perícia judicial realizada (fls. 252/297) que o condomínio onde está localizado o imóvel possui portaria com segurança, salão de festas, piscina, academia e brinquedoteca. Enquanto a unidade objeto do leilão é constituída de dois pavimentos, sendo: (I) pavimento inferior: sala de jantar, sala estar, lavabo, 04 quartos sendo 01 suíte, 03 dormitórios, banheiro social, cozinha, área serviço e dependências de empregada; (II) pavimento superior: sala de tv, banheiro e terraço. O débito atualizado de condomínio, conforme informação fornecida pela administradora em julho de 2025, totaliza R$ 232.016,64 (ref. aos autos do processo nºs 1011313-34.2020.8.26.0003 e 1028371-79.2022.8.26.0003). Conforme declaração do condomínio exequente, o arrematante somente passará a ser responsável pelo pagamento das cotas condominiais que forem geradas e que vencerem a partir da arrematação",O pagamento desse lote será feito por meio de uma guia de depósito judicial e a comissão do leiloeiro deverá ser depositada em conta corrente a ser informada. Toda a instrução de pagamento será enviada ao e-mail cadastrado do vencedor.,SÃO PAULO / SP,JABAQUARA,"RUA DOS DEMOCRATAS, N° 691",Apartamento Duplex,https://encurtador.com.br/vefmW,Carolina Lauro Sodre Santoro / 758,n/a,https://photos.sodresantoro.com.br/imoveis/27357/2647852/1751987031_I16629N1.JPG?ims=x597,https://photos.sodresantoro.com.br/imoveis/27357/2647852/1751987031_I16629N2.JPG?ims=x597,https://photos.sodresantoro.com.br/imoveis/27357/2647852/1751987031_I16629N3.JPG?ims=x597
